{
  "format_version": "3.0",
  "metadata": {
    "debtmap_version": "0.21.2",
    "generated_at": "2026-01-01T00:00:00Z",
    "project_root": "/workspace/project",
    "analysis_type": "unified"
  },
  "summary": {
    "total_items": 2,
    "total_debt_score": 75.0,
    "debt_density": 75.0,
    "total_loc": 1000,
    "by_type": {
      "File": 1,
      "Function": 1
    },
    "by_category": {
      "Architecture": 1,
      "CodeQuality": 1
    },
    "score_distribution": {
      "critical": 0,
      "high": 1,
      "medium": 1,
      "low": 0
    }
  },
  "items": [
    {
      "type": "Function",
      "score": 55.0,
      "category": "CodeQuality",
      "priority": "high",
      "location": {
        "file": "src/lib.rs",
        "line": 10,
        "function": "hotspot"
      },
      "metrics": {
        "cyclomatic_complexity": 12,
        "cognitive_complexity": 18,
        "length": 40,
        "nesting_depth": 4,
        "coverage": 0.5,
        "uncovered_lines": [11, 12]
      },
      "debt_type": {
        "ComplexityHotspot": {
          "cyclomatic": 12,
          "cognitive": 18
        }
      },
      "function_role": "PureLogic",
      "dependencies": {
        "upstream_count": 1,
        "downstream_count": 2,
        "upstream_callers": ["main"],
        "downstream_callees": ["parse", "write"]
      },
      "impact": {
        "coverage_improvement": 0.5,
        "complexity_reduction": 6.0,
        "risk_reduction": 8.0
      },
      "scoring_details": {
        "coverage_score": 5.0,
        "complexity_score": 12.0,
        "dependency_score": 3.0,
        "base_score": 20.0,
        "entropy_dampening": 1.0,
        "role_multiplier": 1.0,
        "final_score": 55.0,
        "purity_factor": 0.0,
        "refactorability_factor": 1.0,
        "pattern_factor": 1.0,
        "structural_multiplier": 1.0,
        "context_multiplier": 1.0
      }
    },
    {
      "type": "File",
      "score": 20.0,
      "category": "Architecture",
      "priority": "medium",
      "location": {
        "file": "src/lib.rs"
      },
      "metrics": {
        "lines": 1000,
        "functions": 20,
        "classes": 1,
        "avg_complexity": 8.0,
        "max_complexity": 18,
        "total_complexity": 160,
        "coverage": 0.5,
        "uncovered_lines": 500
      },
      "impact": {
        "complexity_reduction": 10.0,
        "maintainability_improvement": 0.2,
        "test_effort": 5.0
      },
      "scoring_details": {
        "file_size_score": 5.0,
        "function_count_score": 5.0,
        "complexity_score": 8.0,
        "coverage_penalty": 2.0
      }
    }
  ]
}
